company_name,request_url,request_company_url,location,tags,founding_date,founders,employee_range,urls,emails,phones,description_short,description
Searchfuse Technology Corporation,https://e27.co/startup/searchfuse-technology-corporati,searchfuse.com,Philippines,,,,1,,,,"Searchfuse Marketing Management, the brains behind Searchfuse, has offices in Dubai, London, and Manila. We provide the full plate of digital marketing services as an extension to start-ups & companie",
OrangeApps,https://e27.co/startup/orangeapp,orangeapps.ph,Philippines,"Education,Enterprise Solution",,,0,https://www.facebook.com/orangeappsph/,,,OrangeApps school management system is a web and mobile platform that allows schools to manage it's entire operation using an end to end solution,"OrangeApps school management system is a web and mobile platform that allows schools to manage it's entire operation using an end to end solution from online enrollment,tuition fee monitoring,class scheduling, online learning and a whole lot more. Schools will now be able to save time, money and focus more on providing better education."
FireVisor Systems,https://e27.co/startup/firevisor-system,firevisor.com,Singapore,,,,1,,,,"We understand complex data generated inside our client's manufacturing lines and use that to save 40% of sales revenue. Our AI solution predicts defects before they happen, reduce failures and scrap.",FireVisor Is Creating Self-Aware Factories
Quifers,https://e27.co/startup/quifer,quifers.com,India,"Logistics/Supply Chain,Transportation,Travel",,,0,"http://www.twitter.com/Quiferstweet,https://www.facebook.com/pages/Quifers/348594055351913,https://www.linkedin.com/company/9438797",,,A mini truck rental service providing low cost & hassle free goods transport.,A mini truck rental service providing low cost & hassle free goods transport.
Cloud Clipping Path,https://e27.co/startup/cloud-clipping-path,cloudclippingpath.com,United States of America,,May 2012,,1,"http://www.twitter.com/Cloud_Clipping,https://www.facebook.com/cloudclippingpath,https://www.linkedin.com/company/cloud-clipping-path",,,"Cloud Clipping path is a professional photo editing service provider. We provide any type of photo editings like photo retouching, Shadow effects, Neck Join, Image Optimization for e-Commerce business","Cloud Clipping path is a professional photo editing service provider. We provide any type of photo editings like photo retouching, Shadow effects, Neck Join, Image Optimization for e-Commerce Online store and Real estate business."
WhatsNew Asia,https://e27.co/startup/whatsnew-asia,whatsnew.asia,Thailand,Social Enterprise,,,0,https://www.linkedin.com/company/3116138,,,"WhatsNew, backed by Ardent Capital, is Asia's Only Online Lifestyle Destination for All Things Women.","WhatsNew, backed by Ardent Capital, is Asia's Only Online Lifestyle Destination for All Things Women. An eCommerce platform providing 5 verticals that completes a Woman's life ranging from cosmetics to motherhood, allowing consumers to shop all in one location."
Travelshopa,https://e27.co/startup/travelshopa,travelshopa.com,Singapore,"E-commerce,Media,Social Enterprise,Travel",,,0,"http://www.twitter.com/Travelshopa,http://www.facebook.com/travelshopa,https://www.linkedin.com/company/travelshopa",,,"Travelshopa is the only online community dedicated to local shopping across fashion, gifts and homewares.","Travelshopa is the only online community dedicated to local shopping across fashion, gifts and homewares."
Tradelab Software Private Limited,https://e27.co/startup/tradelab-software-private-limited,tradelab.in,India,"Finance,Software as a Service,Agency & Consulting",July 2012,,1,"http://www.twitter.com/Tradelab_in,https://www.facebook.com/tradelabsoft,https://www.linkedin.com/company/3503249?trk=tyah&trkInfo=clickedVertical%3Acompany%2CclickedEntityId%3A3503249%2Cidx%3A2-1-2%2CtarId%3A1451374713308%2Ctas%3ATradelab%20Software",,,Tradelab Software Private Limited is a start-up in capital market domain with the vision of driving finance through technology.,"Tradelab was conceptualized in July, 2012 at Kolkata by IIT Kharagpur alumni Sandeep and Biplab and very soon the idea was shared with Sanjit, Satish, Dilip & Rakesh. Six multi-faceted brains laid the foundation of Tradelab. The team size rapidly grew to 12 after taking 6 more enthusiasts on board, each supporting the other like the pillars of a house. When they talk about work culture, it’s a very open and flattened hierarchy, the entire team toils round the clock to prove their mettle and provide stock market brokers with highly advanced software and tools. Tradelab also provides consultancy services to brokers in developing features into their existing software and to make it more user-friendly. Tradelab has more than a dozen clients across the country."
FOMO Pay,https://e27.co/startup/fomo-pay,fomopay.com,Singapore,,,,1,,,,"Singapore’s leading alternative payment platform, FOMO Pay enables merchants to accept payments from different wallets like WeChat Pay, NETSPay, Apple Pay, mVisa etc. ",
Cerebrex,https://e27.co/startup/cerebrex,cerebrexinc.com,Japan,"Consumer,Hardware,Manufacturing",,,0,,,,"Headquartered in Osaka, Japan, and founded in 2012, CerebrEX Corporation is a venture-backed semiconductor start-up in the business of developing proprietary","Headquartered in Osaka, Japan, and founded in 2012, CerebrEX Corporation is a venture-backed semiconductor start-up in the business of developing proprietary display technologies for the flat panel display market. The company directly addresses the challenges posed by conventional design, small pixels and high resolution. The company has an additional office in Tokyo, Japan."
StaffCircle Ltd,https://e27.co/startup/staffcircle-ltd,staffcircle.com,United Kingdom,,,,1,,,,"StaffCircle provides a work platform which improves internal communication and feedback and provides easy access to training, ideas, tasks and company directory.",
5staressays,https://e27.co/startup/5staressay,5staressays.com,United States of America,Education,,,1,,,,We are a team of highly professional academic writers having expertise in producing documents ranging from high school to doctoral levels.,"If you require your essay, article or thesis to be written, no matter how difficult it is, we will do it ensuring zero plagiarism and unique content. Our quality work has earned the trust of more than 2000 customers and it is just a beginning."
Wateroam,https://e27.co/startup/wateroam,wateroam.com,Singapore,"Energy,Manufacturing,Social Enterprise",2014,,1,"https://www.facebook.com/wateroamsg,https://www.linkedin.com/company/wateroam",,,"WateROAM is a water innovation social enterprise that aims to develop highly affordable, portable & durable solutions for the benefit of mankind. ","WateROAM was founded in Singapore in 2014 as a water innovation social enterprise.It aims to develop highly affordable, portable & durable solutions for the benefit of mankind. They believe in simple design for maximum social impact, so that every human can have equal access to clean drinking water."
Buildmatic,https://e27.co/startup/buildmatic,buildmatic.in,India,,January 2016,,1,"http://www.twitter.com/buildmaticindia,http://www.facebook.com/buildmatic,https://www.linkedin.com/company/buildmatic",,,Buildmatic seeks to solve the pain areas in the Indian construction industry through an online product and services marketplace model. Visit us @ www.buildmatic.in  or drop us a mail to get in touch.,
National Tiles-Springwood,https://e27.co/startup/national-tiles-springwood,nationaltiles.com.au,Australia,,,,1,,,,"National Tiles was established in 1979 by founder Frank Walker. Now under the guidance of Frank’s son and CEO Nick Walker, the company today is a market leader in tile and stone flooring. ",
DECOR8.ID,https://e27.co/startup/decor8-id,decor8.id,Indonesia,"Consumer,Design ,E-commerce",December 2017,,1,https://www.linkedin.com/company/ptmma/,,,"DECOR8.ID helps you put the things you love on your walls. We combine the personalized service of a frame shop with an online experience to make custom framing easy, affordable and available 24/7.","DECOR8.ID helps you put the things you love on your walls. We combine the personalized service of a frame shop with a guided online experience to make timeless custom framing easy, affordable and available from home. We also offer comprehensive trade services to help artists and designers expand their businesses and spread the joy of art."
Site_Galleria,https://e27.co/startup/site-galleria-1,sitegalleria.com,China,"Design ,E-commerce,Internet of Things,Mobile",June 2014,,0,"http://www.twitter.com/sitegalleria,https://www.facebook.com/sitegalleria,https://www.linkedin.com/company/site-galleria",,,Site Galleria PHP developers have built many effective web applications by fulfilling the most complex business requirement of the clients. Our team of experienced PHP experts and developers analyses,Site Galleria PHP developers have built many effective web applications by fulfilling the most complex business requirement of the clients. Our team of experienced PHP experts and developers analyses your business needs and design the website structure which results in high reliability and quality. PHP is a most widely used website development tool in order to develop dynamic and complex web pages. It is a general-purpose programming language and there are many benefits as it supports multiple types of a web application that include a cross platform compatibility.
DKSH,https://e27.co/startup/dksh,dksh.com,Switzerland,"Logistics/Supply Chain,Agency & Consulting,Advertising",,,0,"http://www.twitter.com/dkshgroup,https://www.facebook.com/dkshgroup/,https://www.linkedin.com/company/11481?trk=tyah&trkInfo=clickedVertical%3Acompany%2CclickedEntityId%3A11481%2Cidx%3A2-1-4%2CtarId%3A1449626920353%2Ctas%3Adksh",,,DKSH is the leading Market Expansion Services Group with a focus on Asia. They help companies who are looking for a reliable outsourcing partner to grow their business in new or existing markets.,DKSH is the leading Market Expansion Services Group with a focus on Asia. They help companies who are looking for a reliable outsourcing partner to grow their business in new or existing markets.
The Curious Kid Education Company,https://e27.co/startup/the-curious-kid-education-company,curiouskidvn.org,Vietnam,,June 2017,,1,"https://www.facebook.com/curiouskidvn/,https://www.linkedin.com/company/the-curious-kid-education-company/",,,"Empowerment. Respect. Choice.Our next generation education initiative enables learners to have choice over what they study, whilst practicing key 21st century skills through an extracurricular program","Curious Kid is a next generation science and arts education initiative that embraces every child’s uniqueness, creativity and self directed curiosity. We have developed an interdisciplinary program that gives learners a choice from 45 different merits. Each merit represents a different topic of study, and each merit has a 6 level structure to ensure learners attain 21st century key skills that are essential to better their future."
Indglobal Private Limited,https://e27.co/startup/indglobal-private-limited,indglobal.in,United Arab Emirates,"Design ,E-commerce,Information & Communications Technology,Mobile,Productivity & CRM,Software as a Service",,,1,"http://www.twitter.com/Indglobal,https://www.facebook.com/indglobal/,https://in.linkedin.com/company/indglobal-consultancy-solutions",,,Indglobal is an award-winning web design and development company in Dubai offering premium web solutions.,"Indglobal Digital is a Premium IT company in Dubai and UAE offering complete web solutions with a commitment to surpass customer expectations by providing excellent and timely delivery of premium web solutions. With a decade of expertise, Indglobal has helped hundreds of organization from start-ups to large enterprises providing high-quality web solutions. We craft wonderful digital experiences that drive your business and provide a trackable ROI for our clients. Our in-house team of experts leverages cutting-edge technologies and proven tactics to create a winning formula for businesses in Dubai."
Blissbox Pte Ltd,https://e27.co/startup/blissbox-pte-ltd,WWW.BLISSBOX.ASIA,Singapore,,July 2016,,1,"https://www.facebook.com/blissboxasia/,https://www.linkedin.com/company/13201219/",,,Blissbox reinvents the gifting industry by providing amazing giftboxes. Gift experiences instead of physical goods and let your friend remember you forever!,"Playing with a curated selection of universes, Blissbox is able to propose amazing gift-boxes where the receiver is entitled to choose one experience out of all those inside each box."
Nexus Financial,https://e27.co/startup/nexus-financial,nexus-financial.com,Burma,,,,1,,,,Nexus Financial is a full-service financial advisor for investors that want to grow their holdings through wise investment strategies. We chart the horizon for fresh opportunities to extract the great,
Accountsportal.co,https://e27.co/startup/accountsportalc,accountsportal.co,United States of America,"Information & Communications Technology,Finance,Software as a Service",March 2015,,1,"http://www.twitter.com/accounts_portal,https://www.facebook.com/accountsportalco/",,,"Accountsportal.co is a reliable bookkeeping organization for all Sage, QuickBooks and Xero related services, headquartered in Los Angeles, California and offers outstanding support.","Accountsportal.co is a software accounting consulting company providing its services in USA. It has achieved the paramount of success by endorsing its subscribers and customers with authentic and wholesome information on resolutions and error resolutions. It is a company which provides proper guidance by trained technicians who are proficient enough to handle all technical and functional aspects of QuickBooks, Sage and other accounting software. We are available round the clock to provide all efficiency in work."
Furmingo,https://e27.co/startup/furming,furmingo.com,Malaysia,"Design ,Agency & Consulting,Information & Communications Technology",December 2016,,1,https://www.facebook.com/Furmingo2U/?fref=ts,,,FURMINGO is a home design platform for everyone,FURMINGO– DESIGN BEYOND IMAGINATION
Ideatory,https://e27.co/startup/ideatory,ideatory.co,Singapore,"Agency & Consulting,Big Data,Software as a Service,Information & Communications Technology",,,0,"http://www.twitter.com/Ideatory,http://www.facebook.com/ideatory,http://www.linkedin.com/groups/Ideatory-Wizard-Network-4229666/about",,,"Ideatory is an open-innovation platform for electronics engineers, hackers, programmers and students to participate in exciting projects to develop electronic products for companies.",Ideatory Pte. Ltd. is a SPRING Singapore (ACE Grant) funded company. They conduct open-innovation competitions to discover young technology talent.
Anchanto,https://e27.co/startup/anchant,anchanto.com,Singapore,"Hardware,E-commerce,Logistics/Supply Chain",,,1,"http://www.twitter.com/anchantodotcom,https://www.facebook.com/anchanto/timeline,https://www.linkedin.com/company/anchanto",,,"Anchanto is a full-service eCommerce fulfillment company, simplifies eCommerce marketing, order management and delivery for world-renowned brands.","Their mission is to let E-commerce companies, sellers and brands focus on what they do best while they take care of providing world class fulfillment technology and infrastructure to them at scale, on demand."
SAPCLE TECHNOLOGIES,https://e27.co/startup/sapcle-technologie,sapcle.com,United Arab Emirates,,,,1,,,,,
Lapersa,https://e27.co/startup/lapersa,Lapersa.net,Singapore,"Agritech,Biotech,Blockchain",January 2008,,1,,,,Agtech with focus on large-scale renewable energy,
99dollar designers,https://e27.co/startup/99dollar-designer,99dollardesigners.com,Indonesia,"Design ,Information & Communications Technology",,,0,https://www.facebook.com/99dollardesigners,,,"They get your instructions about your design and communicate with you and then after deciding what design and angle to take they write the content , execute it .","They get your instructions about your design and communicate with you and then after deciding what design and angle to take they write the content , execute it and at the end They deliver all the work including all files and extensions that you may require without any extra expense."
Venkat Mangudi Consulting,https://e27.co/startup/venkat-mangudi-consulting,venkatmangudi.com,India,"Enterprise Solution,Agency & Consulting,Information & Communications Technology",January 2006,,0,"http://www.twitter.com/venkatmangudi,https://www.facebook.com/vmcpl,http://www.linkedin.com/company/venkat-mangudi-consulting",,,"Venkat Mangudi Consulting is a Strategy Consulting company based in Bangalore, India that specializes in Enterprise Open Source solutions implementation as a follow up to the consulting engagement.","Venkat Mangudi Consulting is a Strategy Consulting company based in Bangalore, India focusing on Small and Medium Enterprises. One of the primary goals of the company is to reduce technology driven costs while increasing Open Source adoption rates."
IstLike,https://e27.co/startup/istlike,istlike.com,,Social Enterprise,,,0,,,,Get Instagram likes and followers with IstLike! This application help get more likes and followers on Instagram. ,Get Instagram likes and followers with IstLike!
Emerald Colour,https://e27.co/startup/emerald-colour,emeraldcolour.com,United Kingdom,,,,1,"http://www.twitter.com/EmeraldColour,https://en-gb.facebook.com/emeraldcolourltduk/,https://www.linkedin.com/company/emerald-colour",,,"Emerald Colour is a award-winning full-service digital design agency in London & Basingstoke. We produce high-quality Litho, Digital, and Large format printing services.",Emerald Colour is a full-service digital design agency in London & Basingstoke. every digital solution we design or build is created and developed with user experience in mind.
Houseafic.com,https://e27.co/startup/houseafic-com,houseafic.com,India,"Consumer,Big Data,Real Estate",January 2015,,1,,,,"Know More, Do More : Helping people make smarter real estate decisions",
Virtuos Digital Ltd.,https://e27.co/startup/virtuos-digital-ltd,virtuos.com,India,"Information & Communications Technology,Software as a Service",2008,,0,"http://www.twitter.com/virtuos,https://www.facebook.com/Virtuos/,http://linkedin.com/company/virtuos-solutions/",,,"Virtuos- The Experience Consultancy Services Expert in the digital age delivers exceptional business outcomes around customer centricity, ebusiness, social media marketing and the cloud.",
Tab a Doctor,https://e27.co/startup/tab-a-doctor,tabadoctor.com,Singapore,"Enterprise Solution,Software as a Service",,,0,"http://www.twitter.com/tabadoctor,https://www.facebook.com/tabadoctor,https://www.linkedin.com/company/reservation-commerce",,,"Tab a Doctor is a product of Reservation Commerce that helps patients find quality healthcare abroad (attractive prices, accredited hospital, and the right doctors)",Tab a Doctor is a healthcare portal that provides:
Lion and Lion,https://e27.co/startup/lion-and-li,lionandlion.com,Singapore,"Agency & Consulting,Advertising",June 2013,,1,"http://www.twitter.com/LionLionDigital,https://www.facebook.com/lionandlion,https://www.linkedin.com/company/lion&lion",,,"Lion & Lion is a fast growing and award winning digital agency based in South East Asia working with some top clients such as Adidas, L’Oreal, AXA & IKEA and with offices in SG, MY, HK and ID.","Lion & Lion is a fast growing and award winning digital agency based in South East Asia working with some top clients such as Adidas, L’Oreal, AXA & IKEA and with offices in SG, MY, HK and ID. Lion & Lion SG is the newest addition and has already won key accounts such as Victoria’s Secret, Guardian and Mundipharma. Lion & Lion consists of a diverse and experienced global team, passionate about creating success. If you are driven, talented and love digital, you could be our next Lion."
EasyLaw,https://e27.co/startup/easylaw,easylaw.asia,Malaysia,Enterprise Solution,November 2016,,1,http://www.facebook.com/easylawmy,,,"EasyLaw -No. 1 Legal App In Malaysia & Singapore - We connect clients & lawyers in a single discovery platform.We transform legal profession by making law (E)fficient, (A)ffordable, (S)imple to (Y)ou.",EasyLaw - No. 1 Legal App in Malaysia & Singapore.
Vimax Asli Canada,https://e27.co/startup/vimax-asli-canada,faktavimax.com,Indonesia,,,,1,,,,"Vimax Asli Canada sebagai obat kesehatan alat vital pria yang akan menjadi penambah kekuatan stamina, memperbaiki fungsi dan merubah ukuran menjadi lebih baik lagi.","Jika Anda saat ini tidak puas dengan ukuran penis Anda maka tidak terlihat lagi. Kami telah menciptakan Vimax Sistem untuk pria yang ingin memperbesar ukuran penis mereka dan ketebalan dengan menggabungkan semua yang terbaik metode pembesaran penis yang dikenal saat ini. Vimax Sistem menggabungkan semua alat yang paling ampuh untuk menyediakan Anda dengan cepat, pengobatan yang paling efektif di pasar! Jika Anda ingin ukuran yang lebih baik, stamina, dan seks terbaik yang pernah Anda miliki, Vimax Sistem adalah gerbang menuju kesuksesan. Saya memiliki pengalaman besar dengan pil male enhancement dan perangkat pembesaran penis Extenders. Saya mulai belajar enhancer laki-laki pada tahun 2008. Pertama kali saya mencoba mereka pada tahun 2016, saya senang dengan hasil saya dan pada tahun 2009 saya memutuskan untuk membuka toko online sendiri di Rusia untuk pria yang membutuhkan bantuan dengan tambahan laki-laki. Sejak saat itu saya memiliki berbagai masukan dari pelanggan saya berbagai usia dan fisik. Saya akan posting ulasan yang nyata dari pelanggan saya diterjemahkan ke bahasa Inggris kasihan tata bahasa saya."
Patron,https://e27.co/startup/patr,patron-ico.io,Japan,,,,1,"https://business.facebook.com/hisatsumi0530/,https://www.linkedin.com/company/patron-ico/",,,"Influencers and social media (SNS) users from around the world can publish, discover, reserve, or sell influencer data on PATRON’s trustless platform on both web and mobile. PATRON is a one stop shop","Influencers and social media (SNS) users from around the world can publish, discover, reserve, or sell influencer data on PATRON’s trustless platform on both web and mobile. PATRON is a one stop shop for social media influencer focused brands and influencers themselves."
ZuperMeal,https://e27.co/startup/zupermeal,zupermeal.com,India,"Consumer,Food & Beverage,Mobile,Software as a Service,Information & Communications Technology",,,0,"http://www.twitter.com/zupermeal,https://www.facebook.com/zupermealindia,https://www.linkedin.com/company/zuper-meal",,,"ZuperMeal is a platform that enables home cooks to become home ""chefs"" and market their signature dishes to the customers looking for healthy and hygienic home-cooked food.","ZuperMeal is a platform that enables home cooks to become home ""chefs"" and market their signature dishes to the customers looking for healthy and hygienic home-cooked food."
MyRefers,https://e27.co/startup/myrefer,myrefers.com,India,"Agency & Consulting,Human Resources,Information & Communications Technology",April 2013,,0,"http://www.twitter.com/My_Refers,http://www.facebook.com/Myrefers,https://www.linkedin.com/company/3245947",,,"MyRefers, a Delhi-based referral recruitment platform, they are working towards creating a skill marketplace powered by referrals and data intelligence.","MyRefers, a Delhi-based referral recruitment platform, they are working towards creating skills marketplace powered by referrals and data intelligence."
Slidebot,https://e27.co/startup/slidebot,slidebot.io,Australia,"Enterprise Solution,Software as a Service",,,0,http://www.twitter.com/SlideBotIO,,,Slidebot uses artificial intelligence to understand your content and transform it into visually stunning depictions.,Slidebot uses artificial intelligence to understand your content and transform it into visually stunning depictions.
ExpoStores,https://e27.co/startup/expostore,expostores.com,India,,,,0,https://www.linkedin.com/company/expostores/?originalSubdomain=ph,,,The startup provides AI and blockchain-enabled tradetech platform and trade E2E solutions.,The startup provides AI and blockchain-enabled tradetech platform and trade E2E solutions.
Lively Green – Strategic Design Consultancy,https://e27.co/startup/livelygree,livelygreen.co,Singapore,"Design ,Advertising",April 2017,,1,"http://www.twitter.com/livelygreenco,https://www.facebook.com/livelygreen.co/,http://www.linkedin.com/company/livelygreen",,,"We are a Strategic Design Consultancy building memorable and meaningful branding and communications design through value-driven, long-term partnerships with businesses and communities.","We create engaging and compelling brand experiences for startups, corporates, and communities to create immersive impact on their audiences. We provides pragmatic solutions for the common and uncommon problems that enduring brands face."
FITA Academy,https://e27.co/startup/fita-academy,fitaacademy.com,India,,,,1,,,,FITA Academy - No:1 career development center which helps you to enhance your skills to step into the IT company for more IT certifications details call @98404-11333.,
