company_name,request_url,request_company_url,location,tags,founding_date,founders,employee_range,urls,emails,phones,description_short,description
Insomniacs,https://e27.co/startup/insomniac,insomniacs.in,India,,April 2015,,1,"http://www.twitter.com/beinsomniacs,https://www.facebook.com/beinsomniacs/?fref=ts,https://www.linkedin.com/company/insomniacs/",,,"Insomniacs, a web development company in Mumbai, gift your business a website and let the internet set things rolling.",
5xRuby,https://e27.co/startup/5xruby,5xruby.tw,Taiwan,Education,,,0,,,,5xRuby has helped to build the Ruby developer community in Taiwan by being the lead evangelists for the region.,"5xRuby has helped to build the Ruby developer community in Taiwan by being the lead evangelists for the region. The firm caters to high tech clients from Japan, Hong Kong & Taiwan developing web and mobile applications."
Utagoe,https://e27.co/startup/utagoe,utagoe.com,Japan,"Entertainment,Media,Mobile,Software as a Service,Information & Communications Technology",January 2001,,0,"http://www.twitter.com/momentdiary,http://www.facebook.com/momentdiary",,,Utagoe is a web company specializing in video and communication technologies. It is headquartered in Tokyo with a branch office in San Jose.,"Utagoe is a web company specializing in video and communication technologies. It is headquartered in Tokyo with a branch office in San Jose. The company name means ""singing voice"" in Japanese. It is a symbol for communications common to human races, exceeds the generations, religions or languages."
Laku6,https://e27.co/startup/laku6,laku6.com,Indonesia,"E-commerce,Mobile,Information & Communications Technology",,,0,https://www.facebook.com/Laku6com-1598612930405678/,,,Laku6.com solves the problem of Buying and Selling used phone. Laku6.com goal is to realize Purchase \ Sales Hp Second Safe and Simple.,"Laku6.com solves the problem of Buying and Selling used phone. The current experience of buying and selling used phones is very vague and uncertain, buyers are not informed on the accurate market price and sellers are usually random forum users. Offline stores experience is even worse. Laku6.com provides recently daily data on market price and trends of the popular phones and also provides quality assurance on the devices they sell."
Goappx,https://e27.co/startup/goappx,goappx.com,United States of America,,January 2010,,0,"http://www.twitter.com/goappx,https://www.linkedin.com/company/goappx",,,Goappx - A leading IT firm offers on-demand web and mobile applications.,Goappx's mission is to help all the vendors covert their local business into online and make it universally accessible and useful.
Mices Technology,https://e27.co/startup/mices-technology,mices.com.my,Malaysia,Advertising,January 2001,,1,,,,We help to build your website and mobile apps (e-Commerce solution) and bring traffic to your business (online advertising solution).,
Invade Space,https://e27.co/startup/invade-space,invade.co,Singapore,Retail,,,0,https://www.linkedin.com/company/10498254,,,Invade Space deals with retail management services and retail spaces.,Invade Space deals with retail management services and retail spaces.
ExtraCarbon,https://e27.co/startup/extracarb,extracarbon.com,India,"E-commerce,Energy",,,0,"http://www.twitter.com/ExtraCarbon,https://www.facebook.com/Extracarboncom,https://www.linkedin.com/company/www-extracarbon-com",,,Extracarbon.com is built by small team in Gurgaon. It is a young and energetic organisation that aims to reduce the carbon from planet through effective waste collection,Extracarbon.com is built by small team in Gurgaon. It is a young and energetic organisation that aims to reduce the carbon from planet through effective waste collection and its proper recycling as well as conserving energy. At Extracarbon.com we strive to accomplish the highest level of “User Participation” possible.
Zenprint (Australia) PTY LTD,https://e27.co/startup/zenprint-australia-pty-ltd,zenprint.com.au,Australia,E-commerce,June 2018,,1,"http://www.twitter.com/ZenprintA,https://www.facebook.com/zenprintaustralia/,https://www.linkedin.com/company/zenprint-australia-pty-ltd/",,,"Zenprint offers online printing services in Australia. Free and fast delivery, high-quality products, and easy ordering process make us #1 Printing Company in Australia.","The fastest growing Online Printing company in Australia, Zenprint Australia offers high-quality digital and offset printing products at affordable prices. Working with us, our customers are able to quickly configure and order business cards, brochures, flyers, leaflets, and other products."
Jaco,https://e27.co/startup/jac,getjaco.com,Israel,"Big Data,Software as a Service",,,0,https://www.facebook.com/getjaco,,,"jaco is a new gen usability platform, allowing product & analytics teams to understand how their customers are really using their product.","jaco is a new gen usability platform, allowing product & analytics teams to understand how their customers are really using their product."
Fitbit,https://e27.co/startup/fitbit,fitbit.com,United States of America,"Consumer,Healthtech,Internet of Things,Mobile,Information & Communications Technology",May 2007,,0,"http://www.twitter.com/fitbit,http://www.facebook.com/fitbit,http://www.linkedin.com/company/fitbit",,,"Fitbit offers compact, wireless, wearable sensors that track a person’s daily activities in order to promote a healthy lifestyle.","Fitbit inspires people to exercise more, eat better and live healthier lifestyles."
ButuhBelanja,https://e27.co/startup/butuhbelanja,butuhbelanja.com,Indonesia,E-commerce,,,0,http://www.twitter.com/butuhbelanja,,,ButuhBelanja is a Malang based e-commerce that focuses on daily food and grocery shopping for individual and SMEs.,ButuhBelanja is a Malang based e-commerce that focuses on daily food and grocery shopping for individual and SMEs.
M-Health Tech,https://e27.co/startup/m-health-tech,mhealth.tech,Indonesia,,2013,,1,https://www.linkedin.com/company/m-health-tech?trk=company_logo,,,"We are a secure healthcare platform that unites users, doctors, insurance companies, pharmacies and laboratories into a simple ecosystem of mobile applications.",Mobile Health Technology (M-Health Tech) merupakan sebuah perusahaan yang bergerak di bidang Online Healthcare Technology di bawah naungan PT. Polinasi Iddea Investama.
Trip38,https://e27.co/startup/trip38,trip38.com,India,"Agency & Consulting,Mobile,Software as a Service,Travel",January 2013,,0,"http://www.twitter.com/trip38app,https://www.facebook.com/Trip38,http://www.linkedin.com/company/trip38",,,Trip38 is a mobile-first travel technology solutions provider aiming to redefine how consumers explore destination. ,"With a combined experience of more than 80 years in the areas of travel services, technology, consulting, consumer internet, e-commerce, product strategy and of course successful product start-up experience, They aim to redefine the way consumers travel."
Biosciences,https://e27.co/startup/bioscience,bdbiosciences.com,Singapore,"Biotech,Healthtech",,,0,,,,"BD Biosciences provides flow cytometers, reagents, tools and a wide range of services to support the work of researchers and clinicians who understand disease and improve care.","BD Biosciences provides flow cytometers, reagents, tools and a wide range of services to support the work of researchers and clinicians who understand disease and improve care."
Fipin,https://e27.co/startup/fipi,fipin.com,Singapore,Enterprise Solution,,,0,"http://www.twitter.com/FipinApp,https://www.facebook.com/fipinapp,https://www.linkedin.com/company/fipin",,,Laundry service for tourists in Singapore.,Laundry service for tourists in Singapore.
Selfdrvn Enterprise,https://e27.co/startup/selfdrvn-enterprise,selfdrvn.com,Malaysia,"Big Data,Mobile,Software as a Service,Agency & Consulting,Information & Communications Technology",June 2015,,0,"http://www.twitter.com/selfdrvn,http://facebook.com/selfdrvn,http://linkedin.com/company/selfdrvn",,,"Selfdrvn provides cloud-based Employee Engagement Platform with mobile technology, gamification and big data analytics.","SelfDrvn provides cloud-based Employee Engagement Platform with mobile technology, gamification and big data analytics."
Attorneys Phuket Thailand,https://e27.co/startup/attorneys-phuket-thailand,attorneysphuket.com,Thailand,"Agency & Consulting,Education,Legal",,,0,"http://www.twitter.com/AttorneysPhuket,https://www.facebook.com/pages/Attorneys-Phuket-Thailand/200784513432656,http://th.linkedin.com/pub/attorneys-phuket-thailand/73/6b6/9bb",,,"A full service law firm on the island of Phuket offering corporate, property, and immigration services to foreign and local citizens","A full service law firm on the island of Phuket offering corporate, property, and immigration services to foreign and local citizens"
Bipzy Limited,https://e27.co/startup/bipzy-limited,muktomall.com,Bangladesh,E-commerce,,,1,,,,Muktomall.com is a B2B & B2C online shopping platform in Bangladesh. We provide both wholesale and retail shopping service. Hassle-free shopping at the best price and fast shipping is our motive.,
Bosbis,https://e27.co/startup/bosbi,bosbis.com,Indonesia,"Transportation,Travel",,,0,"http://www.twitter.com/bosbisdotcom,https://www.facebook.com/Bosbiscom-763861927016515,https://www.linkedin.com/company/pt-media-baru-digital",,,"Bosbis.com is a website owned and operated by PT. New Media Digital. Bosbis aims to facilitate the public to purchase bus tickets, travel tickets online.","Bosbis.com is a website owned and operated by PT. New Media Digital. Bosbis aims to facilitate the public to purchase bus tickets, travel tickets online."
Umoove,https://e27.co/startup/umoove,umoove.me,Israel,"Healthtech,Mobile,Software as a Service",January 2010,,0,"http://www.twitter.com/UmooveMe,https://www.facebook.com/Umoove,https://www.linkedin.com/company/umoove-ltd-",,,"Umoove is the first ever, pure software, face and eye tracking, for any mobile device.","Founded in 2010, Umoove is the first ever, pure software, face and eye tracking, for any mobile device. No extra hardware needed. A unique technology (20 filed patents so far), built from ground up, that has attracted the attention of many of the biggest companies in the world."
Day Zero Technology Pte. Ltd.,https://e27.co/startup/day-zero-technology-pte-ltd,dayzero.tech,Singapore,"Enterprise Solution,Software as a Service,Agency & Consulting",July 2017,,1,"http://www.twitter.com/DayZeroTech,http://www.facebook.com/dayzerotech/,http://www.linkedin.com/company/dayzerotech/",,,"Day Zero accelerates company familiarisation & simplifies the onboarding process. Our employee experience solution, delivered via a mobile app, involves new hires from the moment they accept an offer.",Day Zero was formed through the collective experience of recruitment and technology leaders who recognise first-hand the commercial advantage of engaging great talent from the very beginning in the growth of successful business.
,https://e27.co/startup/innteract-asia,innteract.asia,,,,,0,,,,,
P2P Solutions,https://e27.co/startup/p2p-soluti,peoplesolutions.com.sg,Singapore,"Enterprise Solution,Software as a Service",,,0,,,,P2P Solutions business model remains focus on dedicated customer services in IT industry that limiting themselves to handle only a handful of quality customer.,P2P Solutions business model remains focus on dedicated customer services in IT industry that limiting themselves to handle only a handful of quality customer.
Basil Biosolutions,https://e27.co/startup/basil-biosoluti,basilbio.com,India,"Biotech,Healthtech",December 2014,,1,,,,"Basil Biosolutions is a one stop solution for all your research needs. We represent the major suppliers of instruments, consumables and reagents in the field of Molecular Biology (Life-sciences)",
Grafikdistrict Solutions,https://e27.co/startup/grafikdistrict-soluti,grafikdistrict.com,Malaysia,,December 2016,,1,http://www.facebook.com/grafikdistrict/,,,"A one stop solutions for graphic and multimedia design. Specialised in brands, animation, films and print design. Apart from that we provide training in graphic design related applications and tools.","Grafikdistrict is a semi modern industrial space dedicated to the development of graphic design in the form of work, writing, education and retail. The space is a platform for graphic, interior, architecture, product or industrial designers, animator, film maker and motion grapher to grow from just providing design services to an entrepreneur in the creative environment. GrafikDistrict consist of 4 districts, they are:"
Akubic,https://e27.co/startup/akubic,akubic.com,Taiwan,,,,0,,,,Akubic is an IoT solution provider with water monitoring technology.,"Akubic is an IoT solution provider with water monitoring technology. Its sensors can measure and upload multiple water parameters to its cloud-based platform, enabling the monitoring, recording, and analysis of real-time data, providing alerts and enabling decision across aquaculture and water resource management related sectors."
CJ CGV Vietnam,https://e27.co/startup/cj-cgv-vietnam,cgv.vn,Vietnam,Entertainment,December 2005,,0,,,,,
naked Retreats,https://e27.co/startup/naked-retreat,nakedretreats.cn,China,Real Estate,,,0,https://www.facebook.com/naked-Retreats-219041418155574/,,,"naked Retreats offers an accessible refuge, a place to regain balance and restore yourself through closeness to nature, tranquillity, exercise and therapy, in luxurious rural lodgings.","Mankind wasn’t designed to live in a city, to spend his or her days in a glass box, to succeed or fail according to a piece of paper. Our feet aren’t even meant to wear shoes. We are children of Mother Nature. We were born naked."
Breakout,https://e27.co/startup/breakout,breakoutescapegame.com,Malaysia,"Design ,Education,Entertainment,Gaming,Retail,Sports",,,1,http://facebook/breakoutmy,,,"We are an educational entertainment company that design, manufacture, operate and franchise escape game around the world. So far, we have present in USA, Canada, Saudi Arabia, Myanmar &  Malaysia",
Damo,https://e27.co/startup/dam,damo.co,Taiwan,"Agritech,Consumer,Hardware,Mobile",,,0,"http://www.twitter.com/MeetDamo,http://www.facebook.com/meetdamo",,,Damo is the world's first interactive WiFi Display accessory for Android devices.,Damo is the world's first interactive WiFi Display accessory for Android devices.
Standigm,https://e27.co/startup/standigm,standigm.com,South Korea,"Biotech,Energy",,,0,,,,They use the best ideas from artificial intelligence and systems biology,NEW STANDARD FOR PARADIGM-SHIFT DRUG DISCOVERY
GoOutz Yangon,https://e27.co/startup/gooutz,gooutz.com,Singapore,"Advertising,Food & Beverage,Mobile",,,1,"https://www.facebook.com/gooutzyangon/,https://www.linkedin.com/in/kyaw-myint-tin-aa014152/",,,It was launched in 2017 with a mission to help people find the perfect places to enjoy their meals with the people they love. Gooutz to discover great places to eat.,"It was launched in 2017 with a mission to help people find the perfect places to enjoy their meals with the people they love. Gooutz to discover great places to eat – be it for first date, a quick meal nearby, brunch with friends, or a family celebration."
AbilityonWheels,https://e27.co/startup/abilityonwheel,abilityonwheels.org,India,,,,1,"http://www.twitter.com/AbilityonWheels,https://www.facebook.com/abilityonwheels/",,,Ability on Wheels is an effort to encourage the differently- abled to take a big leap towards leading a normal life by increasing mobility and accessibility services and solutions.,"Ability on Wheels is an effort to encourage the differently- abled to take a big leap towards leading a normal life by increasing mobility and accessibility services and solutions. As a first step in this direction, it has launched a first- of- its- kind driving school in India, exclusively for the differently- abled using customized cars in Ahmadabad."
Bluescheme,https://e27.co/startup/bluescheme,bscheme.com,Bangladesh,"Enterprise Solution,Platform",,,0,http://www.twitter.com/b_scheme,,,"A full-service digital agency providing technology services across different industries. A technology firm providing digital media services, cloud solutions and building online ventures.","A technology firm providing digital media services, cloud solutions and building online ventures."
Spark Systems Pte Ltd,https://e27.co/startup/spark-systems-pte-ltd,sparksystems.sg,Singapore,Platform,April 2016,,1,https://www.linkedin.com/company/spark-systems-pte-ltd/,,,"Spark seeks to bridge the gap between product offerings and user needs. Our unique position allows us to play a facilitative role between liquidity providers and takers, enhancing your FX solution.",FX TODAY
Automation Laboratories,https://e27.co/startup/automation-laboratorie,automationlaboratories.com,India,,,,1,"http://www.twitter.com/automationlabo1,https://www.facebook.com/automationlaboratories,https://www.linkedin.com/company/automation-laboratories-home/",,,"Automation Laboratories is an online learning platform featuring 10,000+ courses taught by expert instructors. Take courses in anything from programming languages like Python,Selenium,Automation,AI","Automation Laboratories (https://www.automationlaboratories.com/ ) is an online learning platform featuring 10,000+ courses taught by expert instructors. Take courses in anything from programming languages like Python,Selenium,Automation,AI and Java to personal development classes like design, drawing, writing and yoga. Join the more than 24 million students who are mastering new skills, advancing their careers, and exploring new hobbies on Automation Laboratories."
iMMERSiVELY.co,https://e27.co/startup/immersively-c,immersively.co,Singapore,,,,1,,,,"iMMERSiVELY (Singapore & Malaysia) is a creative startup specialising in immersive technologies, such as Augmented, Virtual and Mixed Reality for corporates and businesses.","iMMERSiVELY is a creative startup specialising in immersive media technologies – producing applications and solutions for businesses across various industries in South East Asia. From Augmented and Virtual reality content and technology development, to 360° content production and more, iMMERSiVELY harnesses these technologies to advance communication, innovation, story narratives and in education."
Gozoomo,https://e27.co/startup/gozoom,gozoomo.com,India,"Automotive,Consumer,E-commerce,Advertising,Information & Communications Technology",,,0,"http://www.twitter.com/gozoomo,https://www.facebook.com/gozoomo,https://www.linkedin.com/company/zoomo-app",,,GoZoomo is a Bangalore based technology start-up pioneering in peer-to-peer transactions of pre-owned cars and providing a hassle free experience.,GoZoomo is a Bangalore based technology start-up pioneering in peer-to-peer transactions of pre-owned cars and providing a hassle free experience.
Gyaanzone,https://e27.co/startup/gyaanzone,gyaanzone.com,India,"Agency & Consulting,Education,Human Resources,Information & Communications Technology",,,0,"http://www.twitter.com/Gyaanzone,https://www.facebook.com/Gyaanzone/,https://www.linkedin.com/company/gyaanzone",,,Gyaanzone is a web portal which endeavours to answer questions arising regarding any issues in the life cycle of a career.,"Gyaanzone is a web portal which endeavors to answer questions arising regarding any issues in the life cycle of a career. From College selection to Job Procurement and from faculty decisions to prospective employers, Gyaanzone will help the decision making and make it simpler to choose out of the many available ideas. Gyaanzone is not only vying to walk you through colleges, universities or job opportunities but much more."
PhotoPeach,https://e27.co/startup/photopeach,photopeach.com,Japan,"Social Enterprise,Information & Communications Technology",,,0,http://www.twitter.com/photopeach,,,PhotoPeach helps you share your memories in a lively and vivid way by moving your photos like a video.,PhotoPeach helps you share your memories in a lively and vivid way by moving your photos like a video.
Trainium Academy,https://e27.co/startup/trainium-academy,trainiumacademy.com,Singapore,Agency & Consulting,,,0,,,,"Trainium Academy helps others discover their elements of success, including mindset, mastery and money skills through training and coaching programmes.","Trainium Academy helps others discover their elements of success, including mindset, mastery and money skills through training and coaching programmes. Specific topics of specialisation include personal branding, future-readiness and financial planning."
Zaplon Tech,https://e27.co/startup/zaplon-tech,zaplontech.com,India,"Advertising,Media,Mobile,Software as a Service,Information & Communications Technology",November 2012,,0,"http://www.twitter.com/ZAPLONtECH,https://www.facebook.com/ZAPLONtECH,https://www.linkedin.com/company/zaplon-tech",,,"Zaplon Tech provides services about Infrastructure and Website development, Social media marketing.","Zaplon Tech provides services about Infrastructure and Website development, Social media marketing."
Handbags Singapore,https://e27.co/startup/handbags-singapore,1030am.com,Singapore,,,,1,,,,Discover the latest fashionable and luxurious collections of handbags to add to your personal collections! Search for the handbag that is not only of high quality but also will complete your fashion.,
KitchenPal,https://e27.co/startup/kitchenpal,kitchenpalapp.com,Singapore,,March 2018,,1,https://www.linkedin.com/company/kitchenpal/,,,"Platform to Help Users Shop, Save, Cook, Eat & Live Better","KitchenPal is a mobile-based digital assistant that revolutionises the way you cook, eat and shop for groceries."
Plackal Tech,https://e27.co/startup/plackal-tech,maya.live,India,"Healthtech,Mobile",,,0,"http://www.twitter.com/MayaTheApp,https://www.linkedin.com/company/plackal-tech",,,"Plackal is on a mission to further women’s health using technology. They are making that happen through a blend of mobile, wearables, analytics and machine learning. Join the revolution!",They are Plackal. They are the team behind the popular health tracking app for women – Maya (Previously LoveCycles). Their app has touched the lives of 6 million women worldwide and they are just getting started!
FairAgora,https://e27.co/startup/fairagora,fairagora.com,Thailand,"Agritech,Enterprise Solution,Big Data,Logistics/Supply Chain,Retail",January 2014,,1,"http://www.twitter.com/fairagora,http://www.linkedin.com/in/Verifik8",,,We are a consultancy firm based in Southeast Asia promoting innovative solution to improve agribusiness social and environmental performances.,
Shapecrunch,https://e27.co/startup/shapecrunch,shapecrunch.com,India,,,,0,http://www.twitter.com/shape_crunch,,,"Making custom foot insoles for people with foot problems such as Flat Feet, Plantar Fasciitis etc with 3D Printing and Smart ML algorithm. No scanner required, just 3 Foot pictures with our app.","Shapecrunch makes custom foot insoles for people with foot problems such as Flat Feet, Plantar Fasciitis, Diabetic Foot etc."
FindAttorneys.Org,https://e27.co/startup/findattorneys-org,findattorneys.org,United States of America,,January 2018,,1,"http://www.twitter.com/attorneys_org,https://www.facebook.com/FindAttorneysOrg-1616906011725349/",,,"Find your attorneys and law firm with Find Attorneys Directory, best and free attorney directory online. Find List of attorney directories, free and paid directory listings of Law Firms and Attorneys.","Find your attorneys and law firm with Find Attorneys Directory, best and free attorney directory online. Find List of attorney directories, free and paid directory listings of Law Firms and Attorneys. FindAttorneys.Org presents legal commentary on wide variety of legal topics. Submit your guest post here for free. We hope you’ll join in on the discussion."
DHL eCommerce (Malaysia) Sdn Bhd,https://e27.co/startup/dhl-ecommerce-malaysia-sdn-bhd,dhl.com,Malaysia,Logistics/Supply Chain,April 2017,,1,,,,"As the world’s leading logistics company, DHL offers a wide range of interesting job challenges and opportunities in our different divisions around the globe","DHL is present in over 220 countries and territories across the globe, making it the most international company in the world. With a workforce exceeding 350,000 employees, we provide solutions for an almost infinite number of logistics needs."
Sandep.jsc,https://e27.co/startup/sandep-jsc,sango.us,Vietnam,,,,1,,,,"Sàn Đẹp nhập khẩu và phân phối, thi công lắp đặt sàn gỗ công nghiệp, sàn gỗ tự nhiên, sàn nhựa, sàn gỗ nhựa ngoài trời giá rẻ tại Hà Nội",
FastCo Pte Ltd,https://e27.co/startup/fastco-pte-ltd,fastjobs.sg,Singapore,,,,0,,,,FastJobs is a fast and simple mobile platform for both job seekers and employers to fill non- executive and part-time jobs on the go.,
Advvy,https://e27.co/startup/advvy,advvy.com,Australia,"Advertising,Media,Enterprise Solution,Software as a Service",October 2015,,1,"http://www.twitter.com/AdvvyHQ,https://www.linkedin.com/company-beta/6402338/",,,"Advvy is a Media Agency workflow platform that streamlines inefficient campaign planning processes so employees can work smarter, while giving management real-time visibility into performance.","Advvy is the only enterprise grade workflow management platform just for Media Agencies. Our cloud-based platform transforms inefficient manual processes into a workflow solution to allow Agency employees to work smarter, while giving management real-time visibility into their campaign activity and performance."
