company_name,request_url,request_company_url,location,tags,founding_date,founders,employee_range,urls,emails,phones,description_short,description
Triple W Media,https://e27.co/startup/triple-w-media,triplewmedia.com,Singapore,"Design ,E-commerce,Advertising",January 2018,,1,"http://www.twitter.com/triplewmedia,https://www.facebook.com/triplewmedia",,,"We strive to help businesses of all sizes generate a higher return from their online efforts. We provide full-fledged digital solutions to generate more online leads, engagements, calls & conversion.","Triple W Media is a Full-Service Web Design Company, offering one-stop solutions from Web Development Services (such as Web Design, Web Development, E-Commerce Websites, Content Management Systems), Digital Marketing Services (such as Search Engine Optimisation, Search Engine Marketing, Social Media Marketing and Email marketing) and Creative Media Services (such as Branding, Logo Design, Packaging Design)."
Crazzy Bazaar,https://e27.co/startup/crazzy-bazaar,crazzybazaar.com,India,E-commerce,,,0,http://www.twitter.com/CrazzyBazaar,,,Being Crazzy is Sensible !! They are a hyperlocal marketplace combining both online and offline shopping with a host of other features!!,Being Crazzy is Sensible !! They are a hyperlocal marketplace combining both online and offline shopping with a host of other features!!
BS Studio,https://e27.co/startup/bs-studi,bitesizestudio.com,Singapore,"Advertising,Media,PR & Communications,Platform",March 2017,,1,,,,We pair advertisers with relevant influencers. ,
Allied Control,https://e27.co/startup/allied-control,allied-control.com,Hong Kong,"Enterprise Solution,Agency & Consulting,Software as a Service",,,0,"http://www.twitter.com/AlliedControl,https://www.facebook.com/sharer.php?u=http%3A%2F%2Fwww.allied-control.com,https://www.linkedin.com/groups/6562191/profile",,,Allied Control is a professional solutions provider to consult and implement practical immersion cooling technology.,"Allied Control is a professional solutions provider to consult and implement practical immersion cooling technology. With the founders and supporters coming from various electronics and industrial fields, the company specializes in creating commercially feasible solutions for high density applications."
Storify News,https://e27.co/startup/storify-new,storifynews.com,Singapore,,September 2018,,1,"http://www.twitter.com/storifynewz,https://www.facebook.com/storifynews,https://www.linkedin.com/company/storify-news/",,,"Make the Web, Tell a Story - Breaking News and latest News Today.","Storify News is an online breaking news and entertainment magazine dedicated to the intersection of trending news, compelling books, technology, hollywood and Bollywood, Politics, US News, Asia News, Europe News, South Africa News, Australia News, Real Estate, Business, Health, Travel, Opinions, Sports, celebrity style, culture and everything in-between."
On-Foot Digital,https://e27.co/startup/on-foot-digital,onfootdigital.com,Philippines,Media,,,0,"https://www.facebook.com/onfootdigital/,https://www.linkedin.com/company/on-foot-digital-pte-ltd-",,,On-Foot Digital is a vision to bridge the gap between unique digital media solutions and the individuals seeking them.,On-Foot Digital is a vision to bridge the gap between unique digital media solutions and the individuals seeking them.
nCinga,https://e27.co/startup/ncinga,ncinga.com,Singapore,"Big Data,Agency & Consulting,Information & Communications Technology",April 2013,,0,https://www.facebook.com/ncingaasia,,,"nCinga is on a mission of unlocking the power of data to help companies make real-time decisions using fast data, analytics and insights.","Most businesses today are not using even 10% of their data in a productive manner. This is due to data disconnect, data variety, missing data and technologies behind their data. nCinga Spark platform integrates all kinds of such data in to one uniform data fabric where business can interact with data to visualize, analyze and make decisions."
Drishti Tech,https://e27.co/startup/drishti-tech,ameyo.com,India,Software as a Service,,,0,"https://www.facebook.com/DrishtiSoft,https://www.linkedin.com/company/drishti-tech",,,Drishti is an innovator of communication technologies. Providing call center software and CIM applications to BPOs & enterprises.,Drishti is an innovator of communication technologies. Providing call center software and CIM applications to BPOs & enterprises.
QiK Stay,https://e27.co/startup/qik-stay,qikstay.com,India,"E-commerce,Travel,Information & Communications Technology",June 2015,,0,"http://www.twitter.com/Qik_Stay,https://www.facebook.com/qikstay,https://www.linkedin.com/company/qik-stay",,,QiK Stay is India’s fastest growing network of affordable premium hotels.,"Remember the days when travelling in a flight, using a taxi, having a smartphone, wearing high-end fashion clothes, eating out at cafes were considered as luxuries? Well, not anymore. Why? Because somebody dared to think different!"
TemanTakita,https://e27.co/startup/temantakita,temantakita.com,Indonesia,"Education,Agency & Consulting",,,0,"http://www.twitter.com/takita,https://www.facebook.com/TemanTakita",,,Portal for talent of children; tips and guidances for talent development; coverage of children's talent activities; profiles of children and people who success because of their talent.,"When turned the life of public figures, they will get the story of the struggle of their parents. A story that shows that parents are a child's education foundation. Unfortunately, many parents are still having difficulties in developing the child's talents. Difficulties range from the lack of knowledge of how to develop the talents of children, lack of knowledge of the diversity of talents of children and success stories of people who have a unique talent, to the limited information on places and activities on the development of the child's talents."
flipClass,https://e27.co/startup/flipcla,flipclass.com,India,"Education,Agency & Consulting,Information & Communications Technology",,,0,"http://www.twitter.com/FlipclassIndia,http://www.facebook.com/flipClass,http://www.linkedin.com/company/gyankosh-solutions-pvt-ltd",,,"flipClass.com is India's leading marketplace for quality home tuition, connecting budding and passionate teachers to students across the country.","flipClass.com is India's leading marketplace for quality home tuitions, connecting budding and passionate teachers to students across the country. They provide part-time tutors who come to your home and teach your child, helping him/her build a strong foundation in key subject areas."
RISE ACCELERATOR,https://e27.co/startup/rise-accel,riseaccel.com,Thailand,Agency & Consulting,January 2016,,1,"https://www.facebook.com/RISEAccelerator/,https://www.linkedin.com/company-beta/13277383/",,,RISE is Regional Corporate Innovation Accelerator. Our vision is to become #1 Corporate Innovation and Startup Accelerator in Southeast Asia and our mission is to drive 1% of GDP for Thailand and SEA.,"RISE is Regional Corporate Innovation Accelerator based out of Thailand. Our vision is to become #1 Corporate Innovation and Startup Accelerator in SE and our mission is to drive 1% of GDP for Thailand and Southeast Asia through our unique Corporate Innovation Platform - RISE Accelerator, RISE Academy and, RISE Venture."
InReceipts Solutions,https://e27.co/startup/inreceipt,inreceipts.com,India,"Advertising,Enterprise Solution,Finance,Big Data,Internet of Things,Mobile,Retail",July 2015,,1,"http://www.twitter.com/inreceipts,https://www.facebook.com/inreceipts/,https://www.linkedin.com/company/inreceipts-com",,,"We are transforming the “Point of Sale” cash counter into an automated “Point of Experience”  with an automated Customer engagement engine with Digital bills, Payments and Loyalty.","InReceipts is pivoted around capturing offline transaction data in real time (POS data), where every transaction / purchase happening at the stores will not only create a Mobile footprint but also in turn will lead to a cascading effect of turning customers into networks of consumers with common B2C customer App."
Zenfluence,https://e27.co/startup/zenfluence,zenfluence.co,Singapore,Advertising,,,1,,,,Zenfluence is a influencer marketing platform helping micro-influencers to get access to local brand collaborations.,
Big Domain Sdn Bhd,https://e27.co/startup/bigdomai,bigdomain.my,Malaysia,"Platform,Software as a Service",November 2017,,1,"http://www.twitter.com/bigdomainmy,https://facebook.com/bigdomain,https://www.linkedin.com/company/bigdomain/",,,BigDomain.MY aimed to be Asia's Largest Marketplace in Online Solutions  featuring latest solutions for B2B and B2C in Cloud,
Travelindex,https://e27.co/startup/travelindex,travelindex.com,Hong Kong,"Consumer,Media,Travel,Information & Communications Technology",January 2006,,0,"http://www.twitter.com/travelindex,http://www.facebook.com/travelindex,https://www.linkedin.com/company/travelindex-network",,,"Travelindex is building the most comprehensive travel and tourism database with human-edited,up to date and validated information accessible via the Internet and other electronic distribution channels","Travelindex is building the most comprehensive travel and tourism database with human-edited, up to date and validated information accessible via the Internet and other electronic distribution channels."
Easy Shopping BD,https://e27.co/startup/easy-shopping-bd,easyshoppingbd.com,Bangladesh,"E-commerce,Information & Communications Technology",November 2014,,1,"http://www.twitter.com/easyshopping_bd,http://facebook.com/easyshopping.bd,https://www.linkedin.com/company/easy-shopping-bd",,,"Easy Shopping BD is one of the leading E-Commerce business in Bangladesh.It begun its journey roughly 2 year ago,with an aim to provide augmented fashion solution for men through improved online shop.","Easy Shopping BD is one of the leading E-Commerce businesses in Bangladesh. It begun its journey roughly a year ago, keeping in mind the on growing need of a reliable and dynamic platform for Bangladeshi internet users, to provide an improved and augmented online shopping experience."
BT eStore,https://e27.co/startup/bt-estore,btes.my,Malaysia,"E-commerce,Hardware,Retail,Information & Communications Technology",January 2013,,0,https://www.facebook.com/BTeStore,,,"BT eStore is a Malaysia online store which promote laptop, server, desktop and other computer stuffs from most of the popular brand like Lenovo, IBM, HP, DELL, Toshiba, Fujitsu, Samsung, and others.","BT eStore is a Malaysia online store which promote laptop, server, desktop and other computer stuffs from most of the popular brand like Lenovo, IBM, HP, DELL, Toshiba, Fujitsu, Samsung, and others."
Scrollback.io,https://e27.co/startup/scrollback-i,scrollback.io,Singapore,"Mobile,Platform,Software as a Service,Information & Communications Technology",,,0,"http://www.twitter.com/Scrollbackio,https://www.facebook.com/scrollback,https://www.linkedin.com/company/scrollback",,,Scrollback is a web and mobile application for online communities conversations.,"Scrollback is a beautiful, open source text chat service designed for communities."
Hikka Music,https://e27.co/startup/hikka-music,hikkamusic.com,Sri Lanka,,,,1,,,,"Enjoy Unlimited Music ! 1st ever international standard music site in Sri Lanka. Discover, enjoy, and share the music you love.","Enjoy Unlimited Music ! 1st ever international standard music site in Sri Lanka. Discover, enjoy, and share the music you love."
Instant Edge Pte Ltd,https://e27.co/startup/instant-edge-pte-ltd,instant-edge.com,Singapore,"Automotive,Enterprise Solution,Agency & Consulting,Logistics/Supply Chain",September 2016,,1,"http://www.twitter.com/InstantEdgeSol,https://www.facebook.com/InstantEdgeSolutions/,https://www.linkedin.com/company/instant-edge",,,"The Enterprise Transformation Platform: Perfect fusion of Business Process- (BPM), Project Portfolio- (PPM), and Service Management (ITSM).",We are a fast-growing enterprise cloud software startup founded by German ex-SAP managers in Singapore.
belancer.com,https://e27.co/startup/belancer-1,belancer.com,Bangladesh,"Human Resources,Advertising,Information & Communications Technology",May 2015,,0,"http://www.twitter.com/belancers,http://facebook.com/belancers,https://www.linkedin.com/company/belancer",,,"Belancer.com is the first online works freelancing Marketplace and Expert Hub in Bangladesh, any Local or Global Employer can Post Project in any category i.e Web, Mobile & Software Development etc.","Belancer is a Bangladeshi online marketplace where companies and freelance professionals connect and collaborate remotely. Local companies or organizations and people can buy and sell services such as design, online marketing, writing, web & mobile app development & any other online-based service. The payment will be made via local payment gateways."
Yconomus,https://e27.co/startup/yconomu,yconomus.com,Singapore,"Blockchain,Consumer,Information & Communications Technology",,,0,"http://www.twitter.com/Yconomus,https://www.linkedin.com/company/yconomus",,,Yconomus is a young company on the Bitcoin arena with great ambitions for the future of virtual assets trading,Yconomus is a young company on the Bitcoin arena with great ambitions for the future of virtual assets trading. They are proud of the virtual assets exchange that they have developed and are confident that they shall bring the art of virtual assets trading to a new high.
Zerto,https://e27.co/startup/zert,zerto.com,United States of America,,,,1,,,,,
Obor Logistics Group,https://e27.co/startup/obor-logistics-group,oborworld.com,Singapore,,January 2016,,1,"http://www.twitter.com/mtgworld,http://www.facebook.com/OBORWorld,http://www.linkedin.com/in/OBORWORLD",,,Freddy Kuan is the leading logistics network operator for the past 17 years and officially invited by the Chinese government for Logistics Development Program since 2015.,
Tomorrow Group Pte Ltd,https://e27.co/startup/tomorrow-group-pte-ltd,tomorrowgrp.com,Singapore,,,,1,"https://www.facebook.com/tomorrowgroupsg/,https://www.linkedin.com/company/tomorrowgroupsingapore/",,,"At Tomorrowgrp, we are brand builders – experts in big thinking, creative and fresh ideas known as marketing and branding consultant who is top branding and marketing agency.",Looking for Branding Agency in Singapore? We help our clients identify and solve their market needs and challenges as brand consultant in singapore.
Qontak,https://e27.co/startup/qontak,qontak.com,Indonesia,"Enterprise Solution,Big Data,Internet of Things",October 2015,,0,"http://www.twitter.com/QontakID,https://www.facebook.com/qontakdotcom,https://www.linkedin.com/company/qontak-com",,,"Qontak.com is a B2B platform providing business contact information and advanced company profiles through its community to help sales, marketing and research professionals in SE Asia.","Qontak.com is Asia's first lead generation & marketing platform, providing verified business contacts and advanced company details. They empower sales, marketers, and researchers to connect and grow businesses. Their solutions are tech-driven, providing verified, clean, accurate and sorted contacts."
DominasiSERP,https://e27.co/startup/dominasiserp,dominasiserp.com,Indonesia,Advertising,June 2015,,1,,,,Dominasiserp.com help startup company to grow its organic traffic using onpage and offpage optimization.,
acepremier,https://e27.co/startup/acepremier,acepremier.com,Malaysia,"Consumer,Media",,,0,,,,AcePremier.com is a dynamic print & new media company established since 2009 by an experienced management team with extensive experience in the media industry.,"AcePremier.com is a dynamic print & new media company established since 2009 by an experienced management team with extensive experience in the media industry. Besides being a magazine and book publisher, it also offers creative & digital marketing services."
LabelState,https://e27.co/startup/labelstate,labelstate.com,Australia,E-commerce,,,0,http://www.twitter.com/labelstate,,,LabelState.com is an online store and music community that allows bands and musicians to sell their merchandise easily and at no cost.,LabelState.com is an online store and music community that allows bands and musicians to sell their merchandise easily and at no cost.
Nutanix,https://e27.co/startup/nutanix,nutanix.com,Australia,Enterprise Solution,,,0,,,,"Nutanix makes infrastructure invisible, elevating IT to focus on the applications and services that power their business.","Nutanix makes infrastructure invisible, elevating IT to focus on the applications and services that power their business."
PoshVine,https://e27.co/startup/poshvine,poshvine.com,India,"Food & Beverage,Advertising,Travel,Information & Communications Technology",October 2011,,0,"http://www.twitter.com/PoshVine,https://www.facebook.com/poshvine,http://www.linkedin.com/pub/posh-vine/37/2a4/bb7",,,PoshVine connects curious locals and travelers with a variety of memorable experiences across multiple locations in India.,"PoshVine connects curious locals and travelers with a variety of memorable experiences across multiple locations in India. Everything from the more expected, must-do activities, like vineyard tours, insider access to the best restaurants, heritage tours and hot air balloon safaris with wine tasting to unique, top-shelf activities like gourmet strolls, culinary masterclasses with top chefs, celebrity spa experiences, etc."
Search Engine Wings,https://e27.co/startup/search-engine-wing,searchenginewings.com,India,"Information & Communications Technology,Internet of Things",,,1,https://www.facebook.com/SearchEngineWings/,,,"We offer various kind of digital marketing training to candidates, We provide training and learning program of SEO, PPC, SMM, SMO e.t.c.","#310, 3rd Floor, Sunny Business Center,"
Trendrz Influencer Marketing Company,https://e27.co/startup/trendrz-influencer-marketing-company,trendrz.com,Philippines,"Gaming,Advertising,Mobile",,,0,"http://www.twitter.com/TrendrzIM,https://www.facebook.com/trendrz/,https://www.linkedin.com/company/trendrz-influencer-marketing-agency",,,Trendrz is a B2B marketing company that focuses on influencer marketing solutions.,"Trendrz is a B2B marketing company that focuses on influencer marketing solutions. They help brands to broadcast their message on their desired pool of audience through our own network of social media influencers. If you are a mobile gaming company, you might be interested with their gaming influencers with hundreds of thousands to millions of audience who could make a memorable gameplay which will make an impact on his existing audience. This is just an example of what they do."
Save22,https://e27.co/startup/save22,save22.com.sg,Singapore,"Advertising,Consumer,E-commerce,Mobile,Information & Communications Technology",,,0,"http://www.twitter.com/save22sg,https://www.facebook.com/save22my,http://www.linkedin.com/company/save22",,,Save22 is an Asian web & mobile shopping app that scans products and finds local stores selling that product.,Save22 is an Asian web & mobile shopping app that scans products and finds local stores selling that product. The iPhone app version of Save22 (then known as Lobangclub) won Asia's Most Valuable App 2011 Award at Singtel TechVenture.
ADOP,https://e27.co/startup/adop,adop.cc,South Korea,"Advertising,Agency & Consulting,Media",,,0,"https://www.facebook.com/ADOPcokr,https://www.linkedin.com/company/adop",,,"ADOP provides consulting, solutions and optimization for media advertising.","ADOP provides consulting, solutions and optimization for media advertising."
Presentation Pro,https://e27.co/startup/presentation-pr,presentationpro.com,United States of America,,,,1,,,,"PresentationPro offer the best templates, animated templates, background themes, presentations and add-ins for any business or personal presentation so everyone can look like a PowerPoint master.",
The TIDE Cebu,https://e27.co/startup/the-tide-cebu,thetidecebu.com,Philippines,"Enterprise Solution,Platform",July 2014,,0,"http://www.twitter.com/theTIDECebu,http://www.facebook.com/TheTIDECebu",,,"The TIDE is a co-working space and entrepreneurship hub in Cebu City, Philippines that provides a flexible and affordable co-working space.",The TIDE is a co-working space and entrepreneurship hub where independent professionals and startups share working space and become part of the community.
DeePoon,https://e27.co/startup/deep,deepoon.com,China,"Hardware,Mobile,Software as a Service",April 2015,,0,,,,DeePoon VR develops head mounted devices as well as VR content. DeePoon’s technology is supported on both PC and mobile platforms.,"DeePoon VR develops head mounted devices as well as VR content. DeePoon’s technology is supported on both PC and mobile platforms. Its VR content distribution platform 3Dbobo has accumulated more than 1.5 million users, according to the company."
3 Roots Studios,https://e27.co/startup/3-roots-studi,3rootsstudios.com,India,"Mobile,Software as a Service,Agency & Consulting,Information & Communications Technology",,,0,"http://www.twitter.com/3RootsStudios,https://www.facebook.com/3RootsStudios/,https://www.linkedin.com/company/3-roots-studios",,,They are the mobility geeks with flair for creativity. Creating best in class solutions to meet your mobility and design needs is their forte.,THEY BEAUTIFY BINARY WITH THEIR INVENTIVE MOBILE APPS! Their multi-faceted team delivers excellence via break-through mobile apps for a variety of businesses irrespective of their size. They offer a mixed bag of mobility solutions that offer tangible business results.
BoTreeTechnologies,https://e27.co/startup/botreetechnologie,botreetechnologies.com,India,"Mobile,Platform,Software as a Service,Agency & Consulting",,,1,"http://www.twitter.com/BoTreeTech,https://www.facebook.com/BoTreeTechnologies/,https://www.linkedin.com/company/botree-consulting",,,"BoTree works with companies as small as a 2 persons startup to large Fortune 500 companies. Since inception in, BoTree has worked with clients across the US, EU, UK and Australia.","BoTree's Canvas to Cloud offering helps companies take ideas from inception to launch through a well-researched and 2013 proven methodology. BoTree has streamlined processes and stringent practices which help quantify quality and delivery. As a part of the Canvas to Cloud offering, BoTree also offers 24 X 7 technical support."
8xpand Technologies Pte Ltd,https://e27.co/startup/8xpand-technologies-pte-ltd,8xpand.com,Singapore,"Finance,Enterprise Solution,Finance,Govtech",February 2008,,1,"https://www.facebook.com/8xpand-Technologies-179942582381490/,https://www.linkedin.com/company/8xpand",,,"We pride ourselves on providing enterprise resource management systems and business analytic solutions over multiple platform including online digital landscape, cloud based servers and web-portals.","With 8xpand, anything is possible with constant technological advances and innovation. We believe that with our technology and creations, the advancement in your business can be beyond your creativity and imagination."
PICK.SG,https://e27.co/startup/pick-sg,pick.sg,Singapore,"Finance,Automotive,Food & Beverage,Enterprise Solution,Agency & Consulting",December 2014,,1,"http://www.twitter.com/wwwpicksg,https://www.facebook.com/pick.applications/?ref=aymt_homepage_panel,https://www.linkedin.com/company/pick.sg",,,INTELLIGENT ENTERPRISE RESOURCE PLANNING SOFTWARE IN THE CLOUD,"Pick.sg is a Smart Enterprise Resource Planning Solution, built into one single platform on the cloud which comprises of Client Management, Order Management and Warehouse Management, developed for the small business founder in mind, that scales with the business. Because only when we are small we dare to dream big"
On-Off Group,https://e27.co/startup/on-off-group,onoffgroup.com,Hong Kong,"Design ,Advertising",,,0,"http://www.twitter.com/onoff_group,https://www.facebook.com/OnOffGroup,https://www.linkedin.com/company/on-off-design-and-technology",,,On-off Group is a service design and customer experience innovation company operating across Asia-Pacific.,They  help businesses create innovative products and services that blend the physical and the digital.
Mitsui Fudosan,https://e27.co/startup/mitsui-fudosa,mitsuifudosan.co.jp,Japan,Real Estate,,,0,,,,"Mitsui Fudosan Co., Ltd. is a major real estate developer in Japan. Mitsui Fudosan is one of the core companies of Mitsui Group.","Mitsui Fudosan Co., Ltd. is a major real estate developer in Japan. Mitsui Fudosan is one of the core companies of Mitsui Group."
Vario Services Pvt. Ltd.,https://e27.co/startup/vari,vario.fitness,India,"E-commerce,Healthtech,Agency & Consulting",August 2015,,1,"http://www.twitter.com/variofitness,https://www.facebook.com/VarioFitnessApp,https://www.linkedin.com/company/vario-fitness-inc-",,,vario.fitness is a fitness aggregator with a unique proposition built for India.  It's a two-sided marketplace creating both demand & supply.,"The company’s business model is based on revenue inflows from its subscribers, and revenue outflows to:"
CaringMoms,https://e27.co/startup/caringmom,instantnano.com,Malaysia,,,,0,,,,"With the goal to “engage, enrich, and empower women,” Caring Moms support entrepreneurial development for mothers.",Our Story
