company_name,request_url,request_company_url,location,tags,founding_date,founders,employee_range,urls,emails,phones,description_short,description
Afternoons With Albert,https://e27.co/startup/afternoons-with-albert,afternoonswithalbert.com,Australia,"Agency & Consulting,Information & Communications Technology",,,0,https://www.facebook.com/afternoonswithalbert/timeline,,,"Afternoons with Albert helps you (and the rest of the world) to find adventure and enjoyment in each moment, to change the way you interact with the everyday.","What gets them out of bed every morning at Afternoons with Albert, is to help you (and the rest of the world) to find adventure and enjoyment in each moment, to change the way you interact with the everyday."
"Zenmak Nutrigencies And Health (P) Ltd.,",https://e27.co/startup/zenmak-nutrigencies-and-health-p-ltd,zenmakglobal.com,India,,November 2017,,1,"http://www.twitter.com/zenmak_global,https://www.facebook.com/Zenmak-Nutrigen-728284954034982,https://www.linkedin.com/in/zenmakglobal/",,,"Zenmak Nutrigencies And Health (P) Ltd. We offer Feed Supplements for Poultry & Live Stock. We offer top organic nutrition products distributors for pig, cattle, chicken, poultry.",ZenmaK is a leading global animal health company and Best animal feed Manufacturers and Supplements Suppliers in India. Top nutrition products supplements manufacturing companies in India and buy organic nutrition products online in India.
CollectOffersID,https://e27.co/startup/collectoffersid,collectoffers.com,Indonesia,,November 2014,,1,,,,"Collect Offers is one of the world’s most trusted online platforms and is leading the way to discover, compare and leverage the best discount deals, exclusive discount offers.",
fourseven,https://e27.co/startup/fourseve,fourseven.com,India,"Consumer,Design ,E-commerce,Information & Communications Technology",2013,,1,"http://www.twitter.com/myfourseven,https://www.facebook.com/myfourseven,https://www.linkedin.com/company/fourseven-services-private-limited",,,fourseven is India’s first high fashion emotive jewellery brand. fourseven delivers distinctive silver jewellery for women who choose happy.,"fourseven is India’s first high fashion emotive jewellery brand. fourseven delivers distinctive silver jewellery for women who choose happy. Our unique collection of charms from fourseven, including charm bracelets, charm anklets, charm necklaces and even charm earrings, is made of pure 92.5 sterling silver and semi-precious stones for wearable jewellery that is a reflection of the things that mean something special to you."
FINNOMENA,https://e27.co/startup/finnomena,finnomena.com,Thailand,"Finance,Information & Communications Technology",December 2015,,1,"http://www.twitter.com/finnomena,http://www.facebook.com/finnomena",,,Finnomena’s goal is to unlock the investment potential in Thai people by providing extraordinary tools and unbiased knowledge needed in investing and personal financial planning.,Finnomena’s goal is to unlock the investment potential in Thai people by providing extraordinary tools and unbiased knowledge needed in investing and personal financial planning.
QuadLabs Technologies Private Limited,https://e27.co/startup/quadlabs-technologies-private-limited,quadlabs.com,India,"E-commerce,Enterprise Solution,Software as a Service,Travel,Information & Communications Technology",,,0,"http://www.twitter.com/Quad_Labs,https://www.facebook.com/quadlabstechnology,http://www.linkedin.com/company/quadlabs-technologies-private-limited",,,QuadLabs Technologies founded in 2006 is a premier travel technology company based in Gurgaon India.,"QuadLabs Technologies founded in 2006 is a premier travel technology company based in Gurgaon India, provides software solution to travel management companies, travel agencies, suppliers, distributors and tour operators. Their products help their customers to automate their business processes, optimize revenue stream and enhance their customer service experience. .They understand the needs of the travel market in diverse geographies and are uniquely equipped to deliver best in class products with the shortest time to market. They specialize in intelligent solutions which have a high degree of adaptability to distinct business processes with travel domain."
Defuzed - App Development Company,https://e27.co/startup/defuzed,defuzed.in,India,,,,1,"http://www.facebook.com/Defuzed,http://www.linkedin.com/company/defuzed",,,"We are a team of very talented designers and app developers in Delhi, Gurgaon and a leading Mobile App Development Company Delhi. We build world class apps for Android, iOS and Web.",WE ARE DEFUZED
SVR GLOBAL SOLUTIONS,https://e27.co/startup/svr-global-soluti,svrglobalsolutions.com,India,,,,1,,,,"We, SVR Global Solutions, an IT Service provider with our services of ERP, Mobile App Development, Software Development, Testing, SEO, web design and development.","We, SVR Global Solutions, an IT Service provider with our services of ERP, Mobile App Development, Software Development, Testing, SEO, web design and development range across industries horizontally and vertically."
Tripfez,https://e27.co/startup/tripfez,tripfez.com,Malaysia,"Consumer,Travel,Information & Communications Technology",,,0,"http://www.twitter.com/tripfez,https://www.facebook.com/tripfez/",,,"Tripfez, a brand owned by Lagisatu Travel Sdn Bhd, is an innovative, state of the art travel portal dedicated to the rise of global Muslim travelers.","Tripfez, a brand owned by Lagisatu Travel Sdn Bhd, is an innovative, state of the art travel portal dedicated to the rise of global Muslim travelers."
ExamBazaar,https://e27.co/startup/exambazaar,exambazaar.com,India,,March 2017,,1,"http://www.twitter.com/exambazaar,https://www.facebook.com/exambazaar/,https://www.linkedin.com/company/exambazaar/",,,"Exambazaar (EB) is one of India’s largest education and coaching discovery platform which provides comprehensive information for test preparation, and career discovery.","Exambazaar (EB) is one of India’s largest education and coaching discovery platform which provides comprehensive information for test preparation for entrance exams, colleges, courses, universities and coaching listings in India, with over 30,000 coaching institutes listed under its platform with a network spanning over 100 cities covering 50+ competitive and 100+ regional exams. The USP of Exambazaar lies in its interactive platform assisting students to"
Filsupport,https://e27.co/startup/filsupport,filsupport.com,Philippines,"Design ,Advertising,Information & Communications Technology",January 2007,,0,"http://www.twitter.com/filsupport,http://www.facebook.com/filsupportwebmarketing,http://www.linkedin.com/company/filsupport",,,Filsupport is an internet marketing company based in the Philippines. The company provides business process outsourcing services.,"Filsupport is an internet marketing company based in the Philippines. The company provides business process outsourcing services mainly in web design, SEO and internet marketing to U.S. clients and more."
Sevya IT,https://e27.co/startup/sevya-it,sevyait.com,India,"Software as a Service,Agency & Consulting",,,0,"http://www.twitter.com/sevya_it,https://www.linkedin.com/company/sevya-it",,,"Sevya is a specialist in SW Systems, Security & Automation Solutions with Integration as the key strength","Sevya is a specialist in SW Systems, Security & Automation Solutions with Integration as the key strength."
TrustMyStaff,https://e27.co/startup/trustmystaff,trustmystaff.com,Cambodia,Human Resources,,,0,"http://www.twitter.com/rotaticonsult,https://www.facebook.com/rotaticonsulting",,,A platform to help companies test potential employment candidate to find if they are a good personality fit. It uses a psychological measurement test to help companies make the ideal hire.,A platform to help companies test potential employment candidate to find if they are a good personality fit. It uses a psychological measurement test to help companies make the ideal hire.
Emizen Tech Pvt. Ltd,https://e27.co/startup/emizen-tech-pvt-ltd,emizentech.com,India,,,,1,"http://www.twitter.com/emizentech,https://www.facebook.com/EmizenTech/,https://www.linkedin.com/company/emizen-tech",,,"Emizen Tech Pvt. Ltd is the most renowned Magento extension development company in India, founded in 2013 offering a great variety of extensive extensions for Magento 2.","Emizen Tech Pvt Ltd is one of the recognized enterprises based on Magento 2 development and extensions in India. Established in the year 2013 with the cool collaboration of three brilliant colleagues. Our developers are certified with Magento, Zend, and Red Hat. Our company has expanded its territory with 20+ Magento2 Extensions with 500+ total number of clients along with the 660+ positive reviews. Since the startup, till now our company has done up to 500+ projects, completing 5+ work experience completed with 97% Jobs. The trio believes in the explosion of innovation, that is the reason they started Emizen Tech Pvt Ltd with the great vision, ''Your Idea Our Innovation''. The power and energy they enforced in their task are now showing it's true colors with the company expansion."
IQST SAP,https://e27.co/startup/iqst-sap,iqstreamtech.com,India,,,,1,"http://www.iqstreamtech.com/sap-hana-training.php,http://www.iqstreamtech.com/sap-abap-training.php",,,One of the top quality SAP FICO training company in Bangalore with 100% placements.  Also offers advanced and updated syllabus and highly experienced tutors and teachers are here to take classes.,"IQST SAP (System Application and Products) offers quality SAP FICO (FI (Financial Accounting) plus CO (Controlling)), ABAP (Advanced Business Application Programming), HANA (high-performance analytic appliance), MM (Material Management), SD (Sales and Distribution) training with choice of most updated syllabus and classrooms. We offer excellent SAP certification training with well equipped lab facilities and infrastructure. We are experts in providing Instructor-led class rooms and Online modes to working professionals, post graduates and graduates and much more."
PinkBlue,https://e27.co/startup/pinkblue,pinkblue.in,India,"E-commerce,Healthtech",,,0,"http://www.twitter.com/PinkBlueIn,https://www.facebook.com/pages/PinkBluein/365534496933211,https://www.linkedin.com/company/pinkblue-in",,,PinkBlue.in is an integrated supply chain solution for clinical/ medical supplies in India (materials & equipments used by healthcare institutions during treatments).,PinkBlue.in is an integrated supply chain solution for clinical/ medical supplies in India (materials & equipments used by healthcare institutions during treatments).
Infonesia,https://e27.co/startup/infonesia,infonesia.fyi,Indonesia,"Agency & Consulting,Platform",,,0,,,,Infonesia is a knowledge sharing platform offering new experience and business model which benefits all stakeholders in the platform.,Infonesia is a knowledge sharing platform offering new experience and business model which benefits all stakeholders in the platform.
BitRefine Group,https://e27.co/startup/bitrefine-group,bitrefine.group,Hong Kong,,September 2016,,1,"http://www.twitter.com/BitRefine,https://www.linkedin.com/company/17941446/",,,"Bitrefine group solves clients’ toughest challenges in the field of machine learning and computer vision. We offer deep data analysis, visual information comprehension, and automation applications","The manufacturing process in general and robotics in particular follows the traditional method of programming a device first and letting it perform the repetitive operation next. In contrast to this approach, machine learning and computer vision allows devices to see, think, and act accordingly. Machine learning in manufacturing will allow machines to solve the problems that typically can only be done by humans and in some cases solve problems that humans are unable to solve."
Gocom.vn,https://e27.co/startup/gocom-v,gocom.vn,Vietnam,Enterprise Solution,,,0,http://www.twitter.com/dacsanvungmien,,,"Find quality Manufacturers, Suppliers, Exporters, Importers, Buyers, best Price, Products and Trade Leads from our award-winning International Trade Site. Import & Export on gocom.vn","Find quality Manufacturers, Suppliers, Exporters, Importers, Buyers, best Price, Products and Trade Leads from our award-winning International Trade Site. Import & Export on gocom.vn."
RocketPunch,https://e27.co/startup/rocketpunch,rocketpunch.com,South Korea,Human Resources,,,0,"http://www.twitter.com/RocketPun_ch,https://www.facebook.com/rocketpunch.inc/",,,RocketPunch is the first and the biggest Korean startup recruiting platform which already connects more than thousands of talents to Korean startups.,RocketPunch is the first and the biggest Korean startup recruiting platform which already connects more than thousands of talents to Korean startups. RocketPunch expands its network to overseas to become the no.1 international job platform in Asia.
Toki.Games,https://e27.co/startup/toki-game,tokipot.com,Singapore,"Entertainment,Gaming",,,1,,,,,
miniDot,https://e27.co/startup/minidot,minidot.openmouse.co,Taiwan,Platform,,,1,"https://www.facebook.com/minidotapp/,https://www.linkedin.com/in/andy-fang-82504178/",,,Social Network for Real Connections,"miniDot is not a new product from the ground up but a polished one with all lessons learned from our iOS App Store featured apps (DearDays, Loop Journal and Loopify). The user feedback revealed that there is a subtle contradiction within people: they want to write their own stories, but their flat lives usually makes them speechless; they eager to be seen, not by friends or family but people they haven’t known; they don’t really need to be anonymous, another identity on the Internet is enough for them to feel comfortable with self-disclosure which is the key to turn strangers into friends; they wan feedback from their stories, but upcoming comments make them anxious and nervous."
Inbound Marketing Indonesia,https://e27.co/startup/inbound-marketing-indonesia,inboundid.com,Indonesia,"Agency & Consulting,Design ,Advertising,Software as a Service,Information & Communications Technology",,,0,"http://www.twitter.com/InboundID,https://www.facebook.com/InboundID,http://www.linkedin.com/company/inbound-marketing-indonesia",,,Inbound Marketing Indonesia is a pioneer in providing inbound marketing services for businesses in Indonesia. ,Inbound Marketing Indonesia is a pioneer in providing inbound marketing services for businesses in Indonesia. They have the technologies and qualified resources to help your company maximize the ROI of marketing efforts.
Chef Mantis,https://e27.co/startup/chef-manti,chefmantis.com,Indonesia,"Consumer,E-commerce,Food & Beverage,Logistics/Supply Chain,Information & Communications Technology",,,0,"http://www.twitter.com/chefmantis,http://facebook.com/chefmantisID",,,Chef Mantis is the place where you feel the sensation of being a chef fast and fun.,Chef Mantis is the place where you feel the sensation of being a chef fast and fun.
Mihuru,https://e27.co/startup/mihuru,mihuru.com,India,Finance,,,0,"https://web.facebook.com/therealmihuru?_rdc=1&_rdr,https://www.linkedin.com/company/13283504/",,,Mihuru is developing personal finance products to empower Indian millennials to achieve their travel and lifestyle goals. Guilt free.,Mihuru is developing personal finance products to empower Indian millennials to achieve their travel and lifestyle goals. Guilt free.
weddingmedia.co,https://e27.co/startup/weddingmedia-c,weddingmedia.co,Singapore,,September 2016,,1,,,,"Weddings Media is simply as the name suggests, We focused on capturing perfect moments during your perfect day.","Weddings Media is simply as the name suggests, We focused on capturing perfect moments during your perfect day. The difference is that we love our work, which is reflected by the quality we offer in our photography and videography opportunities. Not a single photo or video is taken without the highest attention to details, turning a simple snapshot into a work of art that can tell a story."
Jobleja,https://e27.co/startup/jobleja,jobleja.in,India,,January 2019,,1,"http://www.twitter.com/jobleja,https://www.facebook.com/Jobleja-2376818345930659/,https://www.linkedin.com/company/jobleja/",,,Jobleja will be your career advice and assistant in an application process and do a job search and apply on your behalf.,Jobleja have years of professional experience of employment services. Quality of our work is different from others because we fill complete application with 100% correct information and submit after double check. We always submit applications directly on company official website. We provide screenshots and complete excel spreadsheet of all applications.
Sehat Pvt. Ltd.,https://e27.co/startup/sehat-pvt-ltd,sehat.com,India,,,,1,,,,"Sehat.com is an online health portal aiming to educate, guide, and help patients make informed health decisions. We believe, when patients find the right doctor and right hospital.",
WanderSnap,https://e27.co/startup/wandersnap,WanderSnap.co,Hong Kong,"Platform,Social Enterprise,Travel",April 2016,,1,"http://www.twitter.com/loongstoryshort,http://www.facebook.com/wandersnap,https://cn.linkedin.com/in/jenloong",,,Asia's top platform for on-demand creatives for family and business moments. For life.,Look good • Do good
Galaxy infotech,https://e27.co/startup/galaxy-infotech,galaxyinfotech.net,India,"Design ,Mobile,Software as a Service,Agency & Consulting,Information & Communications Technology",December 2004,,0,"http://www.twitter.com/galaxyinfotech,https://www.facebook.com/pages/Galaxy-Infotech/149500478452141,http://www.linkedin.com/company/galaxy-infotech",,,"GALAXY INFOTECH is a Web design company and website development and Software development services firm based in Indore, India. ","GALAXY INFOTECH is a Web design company and website development and Software development services firm based in Indore, India. The company is dedicated to providing SEO consultantcy service 2D/3D Design and Animation work, Web Development Services, Corporate Multimedia CD presentations, SEO Services, and other Multimedia services which help in developing a strong corporate identity. Networking is the buzzword. And considering its growing importance, Galaxy infotech takes into account all activities related to it, viz, Exalted Graphics, Multimedia Enhancement, Our extensive experience and unmatched expertise in all the major web technologies including Microsoft ASP .Net, MS-SQL and customized solutions in open source technologies like PHP, MySql, Content management systems (wordpress, drupal, joomla, modx), Shopping carts (osCommerce, zencart, magento) has made us one of the fastest growing Web Application and Software development companies in India."
PDG Technologies,https://e27.co/startup/pdg-technologie,pdg-technologies.com,Vietnam,"Mobile,Agency & Consulting",,,0,"http://www.twitter.com/PDGTechJSC,https://www.facebook.com/pdgtech,https://www.linkedin.com/company/pdg-technologies",,,"PDG Technologies is a global software and game for mobile, with office in Vietnam and it also has a product named RetailFit.","PDG Technologies is a global software and game for mobile, with office in Vietnam and it also has a product named RetailFit."
Milu Labs,https://e27.co/startup/milu-lab,milulabs.com,Singapore,,,,0,,,,Our mission is to become Asia’s leading diagnostics and analysis company.,Our mission is to become Asia’s leading diagnostics and analysis company.
OutPax Connect,https://e27.co/startup/outpax-connect,outpax.co,Philippines,"Platform,Travel,Information & Communications Technology",July 2015,,0,"http://www.twitter.com/outpaxworld,http://www.facebook.com/outpaxworld",,,"OutPax is an outdoor events platform that allows users to discover, create & register to  activities happening around their location.","OutPax is an outdoor events platform that allows users to discover, create & register to  activities happening around their location."
Spare Parts 3D,https://e27.co/startup/spare-parts-3d,spare-parts-3d.com,Singapore,"Hardware,Enterprise Solution,Manufacturing",,,1,https://www.linkedin.com/company/spare-parts-3d,,,SP3D supports the digitalization of your inventory and enables on-demand & distributed production using 3D printing.,"Spare Parts 3D is a tech startup providing to home appliances manufacturers an end-to-end spare parts management system, thanks to a decentralised model of spare parts production using additive manufacturing technology."
ScaleUp Valley,https://e27.co/startup/scaleup-valley,scaleupvalley.com,United Kingdom,,January 2013,,1,"http://www.twitter.com/scaleup_valley,https://www.facebook.com/scaleupacademy.io/,https://www.linkedin.com/company/9284632/",,,"""Helping the leading scale ups grow into the giants of tomorrow """,STARTING UP IS HARD.
LadiPage Vietnam,https://e27.co/startup/ladipage-vietnam,ladipage.vn,Vietnam,"Design ,E-commerce,Advertising,Software as a Service,Information & Communications Technology",June 2017,,1,,,,"LadiPage is a Landing Page Builder, using drag and drop method to help marketers create Landing Page quickly by themself without any code requirements.",
"I Hit The Jackpot, LLC",https://e27.co/startup/i-hit-the-jackpot-llc,ihitthejackpot.com,United States of America,,,,1,,,,"Unique gaming brand/platform that combines gaming, social casino games, contests and  sweepstakes.",
Ocean House,https://e27.co/startup/ocean-house,oceanhouse.com.au,Australia,,,,1,,,,"Ocean House is extraordinary. A holiday house on the Great Ocean Road that once experienced, is never forgotten. Just 100m stroll from North Lorne’s secluded beach, Ocean House redefines the concept o",
ReadySales,https://e27.co/startup/readysale,readysales.asia,Singapore,"Mobile,Enterprise Solution,Software as a Service,Information & Communications Technology",,,0,"http://www.facebook.com/ReadySales,https://www.linkedin.com/company/6470199?trk=tyah&trkInfo=clickedVertical%3Acompany%2CclickedEntityId%3A6470199%2Cidx%3A1-1-1%2CtarId%3A1441858113543%2Ctas%3AReadySales",,,ReadySales is the mobile CRM solution for the new generation of professionals. In collaboration with sales professionals of major companies.,ReadySales is the industry’s first mobile CRM assistant.
Lifetrack Medical Systems,https://e27.co/startup/lifetrack-medical-system,lifetrackmedicalsystems.com,Philippines,"Agency & Consulting,Healthtech,Software as a Service",,,0,https://www.linkedin.com/company/4823125?trk=tyah&trkInfo=clickedVertical%3Acompany%2CclickedEntityId%3A4823125%2Cidx%3A2-1-2%2CtarId%3A1446189939927%2Ctas%3A%20Lifetrack%20Medical%20Systems,,,"Lifetrack Medical Systems, Inc is the first Asian focused Teleradiology Company to offer both USA International Standard Professional Services.","Lifetrack Medical Systems, Inc is the first Asian focused Teleradiology Company to offer both USA International Standard Professional Services as well as the first RIS/PACS with Integrated Decision Support. They are also the Pioneers of a 100% dual read model Guaranteeing USA International Standard Quality reads on 100% of cases while allowing full integration with your local Radiologists."
Rentafi Pte Ltd,https://e27.co/startup/rentafi-pte-ltd,rentafi.com,Singapore,"Mobile,Information & Communications Technology",,,0,"http://www.twitter.com/Rentafi,https://www.facebook.com/Rentafi",,,Rentafi is a 4G mobile hotspot rental service in Singapore,Rentafi is a 4G mobile hotspot rental service in Singapore.
Darveys,https://e27.co/startup/darvey,darveys.com,India,,,,0,"http://www.twitter.com/Darveyscom,https://www.facebook.com/Darveys",,,"To remarkably extend the boundaries of the Indian luxury fashion market, evolving Darveys as a big sensation.","Broaden your reach for luxury fashion with Darveys.com, a one-stop online fashion store that brings forth all the high-end fashion houses under one roof. Our exhaustive catalog caters to ready-to-wear, accessories, shoes, bags and more from world-famous labels. The inventory is inspired by international runways, celebrity looks, and on-trend classic style. The collections from popular names across the world are available here at discounted prices to match your needs and wants. The website picks the labels and the products from the world and brings it to the Indian audience. We at Darveys work hard to bring together a curated edition of all that you need to step out in style. There is a membership plan which makes you the boss and lets you choose the best products from the different brands at discounted prices."
Altair Semiconductor,https://e27.co/startup/altair-semiconductor,altair-semi.com,Israel,"Hardware,Manufacturing,Mobile",May 2005,,0,"http://www.twitter.com/AltairSemi,https://www.linkedin.com/company/altair-semiconductor",,,Altair is a semiconductor company developing mobile WiMAX silicon solutions optimized for handsets and handheld devices.,"Altair is a fabless semiconductor company based in Israel that is developing state of the art, ultra low power mobile WiMAX silicon solutions optimized for handsets and handheld devices."
Qwords,https://e27.co/startup/qword,qwords.com,Indonesia,Information & Communications Technology,,,0,"http://www.twitter.com/Qwordsdotcom,https://www.facebook.com/qwordsdotcom",,,"Top 5 Cloud Hosting Company in Indonesia, Data Center and Managed Hosting Provider | Call Center: 0804-1-808-888","They focused on Information & Technology Business, Proud to be a part of Retail Service Industry and serving their customer like their partner."
brandrefinery.co.uk,https://e27.co/startup/brandrefinery-co-uk,brandrefinery.co.uk,United Kingdom,,,,1,,,,"brandrefinery.co.uk is an one of the best online Crowdfunding Consultant in UK, Here you can promote your product in various places  just visit our site and contact with us for latest offers.",
